dataset_id,cell_count,unique_cell_types,tissues,diseases,tissue_general_query,collection_name,collection_doi,dataset_title,dataset_h5ad_path,dataset_total_cell_count
80767859-6001-4fc7-a8e7-602b1e8bd54d,0,0,,,blood;brain;intestine;kidney;liver;lung,Cellular heterogeneity and dynamics of the human uterus in healthy premenopausal women,10.1073/pnas.2404775121,Unciliated epithelial cells from five healthy donors,80767859-6001-4fc7-a8e7-602b1e8bd54d.h5ad,5286
80a2c5b6-02e7-4fc0-9f12-179f5247c1bc,0,0,,,blood;brain;intestine;kidney;liver;lung,Cells of the human intestinal tract mapped across space and time,10.1038/s41586-021-03852-1,Total - Cells of the human intestinal tract mapped across space and time,80a2c5b6-02e7-4fc0-9f12-179f5247c1bc.h5ad,428469
80d7111d-f9fe-49fd-871e-6e618312c341,0,0,,,blood;brain;intestine;kidney;liver;lung,Single-cell transcriptome analysis reveals differential nutrient absorption functions in human intestine,10.1084/jem.20191130,Rectum,80d7111d-f9fe-49fd-871e-6e618312c341.h5ad,3797
810ac45f-8969-4698-b42c-652f802f75c2,0,0,,,blood;brain;intestine;kidney;liver;lung,A human fetal lung cell atlas uncovers proximal-distal gradients of differentiation and key regulators of epithelial fates,10.1016/j.cell.2022.11.005,Endothelium,810ac45f-8969-4698-b42c-652f802f75c2.h5ad,5467
814f2c97-49e4-4a17-be26-fde3c4c57d1b,0,0,,,blood;brain;intestine;kidney;liver;lung,A cell atlas of human thymic development defines T cell repertoire formation,10.1126/science.aay3224,Human Stem Cells (LIV and TH) - A cell atlas of human thymic development defines T cell repertoire formation,814f2c97-49e4-4a17-be26-fde3c4c57d1b.h5ad,27589
81c2d711-7fd5-48f0-bc74-57229f3c9554,0,0,,,blood;brain;intestine;kidney;liver;lung,Spatially organized multicellular immune hubs in human colorectal cancer,10.1016/j.cell.2021.08.003,Epithelial cells,81c2d711-7fd5-48f0-bc74-57229f3c9554.h5ad,168295
81e91ff8-f619-4ad1-a0c3-b45e1dc63f68,0,0,,,blood;brain;intestine;kidney;liver;lung,SEA-AD: Seattle Alzheimer’s Disease Brain Cell Atlas,10.1038/s41593-024-01774-5,Sst Chodl - MTG: Seattle Alzheimer's Disease Atlas (SEA-AD),81e91ff8-f619-4ad1-a0c3-b45e1dc63f68.h5ad,1496
81ffdcd6-3f04-40bc-8bb0-9748f4ffe576,0,0,,,blood;brain;intestine;kidney;liver;lung,Human Immune Health Atlas,10.1038/s41586-025-09686-5,Human Immune Health Atlas Other cells,81ffdcd6-3f04-40bc-8bb0-9748f4ffe576.h5ad,10937
821a8e3e-87ec-41ee-bd69-cd4377057d38,0,0,,,blood;brain;intestine;kidney;liver;lung,Human subcutaneous and visceral adipocyte atlases uncover classical and non-classical adipocytes and depot-specific patterns,10.1038/s41588-024-02048-3,snRNA-seq of human subcutaneous adipose tissue - all cells,821a8e3e-87ec-41ee-bd69-cd4377057d38.h5ad,37879
82346769-8733-485e-ab49-f14923d2b5bc,0,0,,,blood;brain;intestine;kidney;liver;lung,Deciphering glial contributions to CSF1R-related disorder via single-nuclear transcriptomic profiling,10.1186/s40478-024-01853-5,OPCs,82346769-8733-485e-ab49-f14923d2b5bc.h5ad,3324
829a3cd1-a466-49f1-b2e9-d3f6b7f392e2,11307,1,liver;lung,colorectal cancer,blood;brain;intestine;kidney;liver;lung,Progressive plasticity during colorectal cancer metastasis,10.1038/s41586-024-08560-0,progressive_plasticity_during_crc_metastasis_epithelial,829a3cd1-a466-49f1-b2e9-d3f6b7f392e2.h5ad,47107
82f6af6d-5313-439a-9936-5e844be49a70,0,0,,,blood;brain;intestine;kidney;liver;lung,"Early role for a Na+,K+-ATPase (ATP1A3) in brain development",10.1073/pnas.2023333118,Infant human neocortex cells,82f6af6d-5313-439a-9936-5e844be49a70.h5ad,51878
83b5e943-a1d5-4164-b3f2-f7a37f01b524,0,0,,,blood;brain;intestine;kidney;liver;lung,Pathogenic variants damage cell composition and single cell transcription in cardiomyopathies,10.1126/science.abo1984,DCM/ACM heart cell atlas: Neuronal cells,83b5e943-a1d5-4164-b3f2-f7a37f01b524.h5ad,7999
83d62c7b-3439-47ba-988c-d99e705bda12,0,0,,,blood;brain;intestine;kidney;liver;lung,Profiling of epithelial functional states and fibroblast phenotypes in hormone therapy-naïve localised prostate cancer,10.1101/2024.10.23.619925,Single-cell atlas of 24 hormone therapy naive localised prostate cancers -- SMCs subset,83d62c7b-3439-47ba-988c-d99e705bda12.h5ad,6709
84230ea4-998d-4aa8-8456-81dd54ce23af,5608,7,blood,COVID-19,blood;brain;intestine;kidney;liver;lung,Longitudinal profiling of respiratory and systemic immune responses reveals myeloid cell-driven lung inflammation in severe COVID-19,10.1016/j.immuni.2021.03.005,74 years old female - Fresh PBMCs (3 days post-intubation),84230ea4-998d-4aa8-8456-81dd54ce23af.h5ad,5608
84242d25-f656-4ca6-8e8d-f3d2beeba11f,0,0,,,blood;brain;intestine;kidney;liver;lung,"Brain matters: Unveiling the Distinct Contributions of Region, Age, and Sex to Glia diversity and CNS Function",10.1186/s40478-023-01568-z,white matter - microglia,84242d25-f656-4ca6-8e8d-f3d2beeba11f.h5ad,3851
842c6f5d-4a94-4eef-8510-8c792d1124bc,0,0,,,blood;brain;intestine;kidney;liver;lung,A spatially resolved single cell genomic atlas of the adult human breast,10.1038/s41586-023-06252-9,scRNA-seq data - all cells,842c6f5d-4a94-4eef-8510-8c792d1124bc.h5ad,714331
84cfa5aa-a0d1-415e-ac47-eb66c9cf8170,72710,19,liver,intestinal failure–associated liver disease;normal,blood;brain;intestine;kidney;liver;lung,Single-Cell Atlas Of Human Pediatric Liver Reveals Age-Related Hepatic Gene Signatures,10.1097/HC9.0000000000000813,Healthy and IFALD pediatric and adult human liver tissue,84cfa5aa-a0d1-415e-ac47-eb66c9cf8170.h5ad,81001
84f1a631-910b-4fbb-9f76-d915a07316d2,0,0,,,blood;brain;intestine;kidney;liver;lung,Cells of the adult human heart,10.1038/s41586-020-2797-4,Atrial cardiomyocytes — Cells of the adult human heart,84f1a631-910b-4fbb-9f76-d915a07316d2.h5ad,23483
8560f809-5794-484e-9152-b63efa91d134,0,0,,,blood;brain;intestine;kidney;liver;lung,Single cell atlas of the human trabecular meshwork and ciliary body,,scRNA-seq of human ocular anterior segment: trabecular meshwork and ciliary body,8560f809-5794-484e-9152-b63efa91d134.h5ad,332995
856c1b98-5727-49da-bf0f-151bdb8cb056,0,0,,,blood;brain;intestine;kidney;liver;lung,Single-cell transcriptomic atlas of the human retina identifies cell types associated with age-related macular degeneration,10.1038/s41467-019-12780-8,Retina,856c1b98-5727-49da-bf0f-151bdb8cb056.h5ad,20091
85c60876-7f35-40c5-a256-7808d84c6ba5,96129,1,brain,Alzheimer disease;normal,blood;brain;intestine;kidney;liver;lung,Single-soma transcriptomics of tangle-bearing neurons in Alzheimer’s disease,10.1016/j.neuron.2022.06.021,Single-soma transcriptomics of tangle-bearing neurons in Alzheimer’s disease - Excitatory,85c60876-7f35-40c5-a256-7808d84c6ba5.h5ad,96129
8623d55f-d91c-41c2-ae68-ed2072fd268d,0,0,,,blood;brain;intestine;kidney;liver;lung,Cell Atlas of The Human Fovea and Peripheral Retina,10.1038/s41598-020-66092-9,Bipolar cells of the human fovea and peripheral retina,8623d55f-d91c-41c2-ae68-ed2072fd268d.h5ad,25908
86282760-5099-4c71-8cdd-412dcbbbd0b9,0,0,,,blood;brain;intestine;kidney;liver;lung,Blood and immune development in human fetal bone marrow and Down syndrome,10.1038/s41586-021-03929-x,Fetal Bone Marrow (10x) - Down Syndrome,86282760-5099-4c71-8cdd-412dcbbbd0b9.h5ad,16743
867757c1-3b1a-49d9-a0cd-17767eb160cc,0,0,,,blood;brain;intestine;kidney;liver;lung,snRNA-seq of human kidney with ureteral obstruction,10.1038/s41467-025-59997-4,snRNA-seq of human kidney with ureteral obstruction,867757c1-3b1a-49d9-a0cd-17767eb160cc.h5ad,46957
873ff933-4fda-4936-9a70-67df11af90ac,0,0,,,blood;brain;intestine;kidney;liver;lung,Molecular characterization of selectively vulnerable neurons in Alzheimer's Disease,10.1038/s41593-020-00764-7,Molecular characterization of selectively vulnerable neurons in Alzheimer’s Disease: SFG excitatory neurons,873ff933-4fda-4936-9a70-67df11af90ac.h5ad,15833
8775a6c6-b960-43ae-9f76-45c4acda3621,0,0,,,blood;brain;intestine;kidney;liver;lung,Comprehensive cell atlas of the first-trimester developing human brain,10.1126/science.adf1226,ClassErythrocyte,8775a6c6-b960-43ae-9f76-45c4acda3621.h5ad,8959
87a06a2a-16c6-42f7-af1b-529fad431051,0,0,,,blood;brain;intestine;kidney;liver;lung,Recruited macrophages elicit atrial fibrillation,10.1126/science.abq3061,Recruited macrophages elicit atrial fibrillation,87a06a2a-16c6-42f7-af1b-529fad431051.h5ad,41279
881e0e6b-a185-45f1-9b56-81606e91e7ff,0,0,,,blood;brain;intestine;kidney;liver;lung,Profiling of epithelial functional states and fibroblast phenotypes in hormone therapy-naïve localised prostate cancer,10.1101/2024.10.23.619925,Single-cell atlas of 24 hormone therapy naive localised prostate cancers,881e0e6b-a185-45f1-9b56-81606e91e7ff.h5ad,68322
881fe679-c6e0-45a3-9427-c4e81be6921f,7097,8,blood,COVID-19,blood;brain;intestine;kidney;liver;lung,Longitudinal profiling of respiratory and systemic immune responses reveals myeloid cell-driven lung inflammation in severe COVID-19,10.1016/j.immuni.2021.03.005,66 years old female - Fresh PBMCs (2 days post-intubation),881fe679-c6e0-45a3-9427-c4e81be6921f.h5ad,7097
88a01d4a-5197-45be-b5ae-e019aef43376,0,0,,,blood;brain;intestine;kidney;liver;lung,Human Brain Cell Atlas v1.0,10.1126/science.add7046,Dissection: Cerebral cortex (Cx) - Superior Temporal Gyrus - STG,88a01d4a-5197-45be-b5ae-e019aef43376.h5ad,40565
88c483bf-477d-4be5-90d3-4fb101dd601f,0,0,,,blood;brain;intestine;kidney;liver;lung,Urethral luminal epithelia are castration-insensitive cells of the proximal prostate,10.1002/pros.24020,Urethral luminal epithelia are castration-insensitive cells of the proximal prostate - Human Epithelial Cells,88c483bf-477d-4be5-90d3-4fb101dd601f.h5ad,25186
894573ad-498f-47ee-9bec-ad0880147eea,0,0,,,blood;brain;intestine;kidney;liver;lung,"Brain matters: Unveiling the Distinct Contributions of Region, Age, and Sex to Glia diversity and CNS Function",10.1186/s40478-023-01568-z,white matter - neurons,894573ad-498f-47ee-9bec-ad0880147eea.h5ad,10734
8a554710-08bc-4005-87cd-da9675bdc2e7,4232,6,blood,COVID-19,blood;brain;intestine;kidney;liver;lung,Longitudinal profiling of respiratory and systemic immune responses reveals myeloid cell-driven lung inflammation in severe COVID-19,10.1016/j.immuni.2021.03.005,82 years old female - Fresh PBMCs (1 day post-intubation),8a554710-08bc-4005-87cd-da9675bdc2e7.h5ad,4232
8a8aedcb-5bb3-453d-a9f0-f37951ae1515,0,0,,,blood;brain;intestine;kidney;liver;lung,SEA-AD: Seattle Alzheimer’s Disease Brain Cell Atlas,10.1038/s41593-024-01774-5,L6b - MTG: Seattle Alzheimer's Disease Atlas (SEA-AD),8a8aedcb-5bb3-453d-a9f0-f37951ae1515.h5ad,16227
8a95341f-f023-4bff-a1d5-52c7003ab65a,0,0,,,blood;brain;intestine;kidney;liver;lung,Human Oral and Craniofacial Cell Atlas,10.1101/2024.12.01.626279,Mucosal Immune Atlas,8a95341f-f023-4bff-a1d5-52c7003ab65a.h5ad,23064
8a961a54-7e37-41e4-8e7b-463b23146b17,0,0,,,blood;brain;intestine;kidney;liver;lung,Cellular heterogeneity and dynamics of the human uterus in healthy premenopausal women,10.1073/pnas.2404775121,All cell types from integrated dataset of 20 donors,8a961a54-7e37-41e4-8e7b-463b23146b17.h5ad,167910
8b2e5453-faf7-46ea-9073-aea69b283cb7,0,0,,,blood;brain;intestine;kidney;liver;lung,Urethral luminal epithelia are castration-insensitive cells of the proximal prostate,10.1002/pros.24020,Urethral luminal epithelia are castration-insensitive cells of the proximal prostate - All Human Cells,8b2e5453-faf7-46ea-9073-aea69b283cb7.h5ad,28847
8b47073c-8a20-4a37-b234-e1889b43991b,0,0,,,blood;brain;intestine;kidney;liver;lung,Single-cell integration reveals metaplasia in inflammatory gut diseases,10.1038/s41586-024-07571-1,Healthy - Salivary gland,8b47073c-8a20-4a37-b234-e1889b43991b.h5ad,8263
8ba5453f-7fab-4702-a3a6-4021b1f31a7a,0,0,,,blood;brain;intestine;kidney;liver;lung,Human Brain Cell Atlas v1.0,10.1126/science.add7046,Supercluster: Thalamic excitatory,8ba5453f-7fab-4702-a3a6-4021b1f31a7a.h5ad,85546
8c0a3574-b0ad-4e4f-b5d3-d1a743b00d4a,0,0,,,blood;brain;intestine;kidney;liver;lung,Single cell atlas of the human retina,10.1101/2023.11.07.566105,snRNA-seq of human retina - amacrine cell subset,8c0a3574-b0ad-4e4f-b5d3-d1a743b00d4a.h5ad,571579
8c42cfd0-0b0a-46d5-910c-fc833d83c45e,65662,46,blood;lung,normal,blood;brain;intestine;kidney;liver;lung,A molecular cell atlas of the human lung from single cell RNA sequencing,10.1038/s41586-020-2922-4,"Krasnow Lab Human Lung Cell Atlas, 10X",8c42cfd0-0b0a-46d5-910c-fc833d83c45e.h5ad,65662
8c6ed88f-11bf-4159-bad7-ff41fb1e1eca,0,0,,,blood;brain;intestine;kidney;liver;lung,SEA-AD: Seattle Alzheimer’s Disease Brain Cell Atlas,10.1038/s41593-024-01774-5,Chandelier - MTG: Seattle Alzheimer's Disease Atlas (SEA-AD),8c6ed88f-11bf-4159-bad7-ff41fb1e1eca.h5ad,10928
8d1dd010-5cbc-43fb-83f8-e0de8e8517da,0,0,,,blood;brain;intestine;kidney;liver;lung,Transcriptomic cytoarchitecture reveals principles of human neocortex organization,10.1126/science.adf6812,Dissection: Primary visual cortex(V1),8d1dd010-5cbc-43fb-83f8-e0de8e8517da.h5ad,241077
8d73847b-33e7-48f0-837f-e3e6579bf12d,0,0,,,blood;brain;intestine;kidney;liver;lung,Mapping the developing human immune system across organs,10.1126/science.abo0510,"In vitro derived T cells, from Artificial Thymic Organoid protocol",8d73847b-33e7-48f0-837f-e3e6579bf12d.h5ad,10459
8dc29642-be06-46dc-a289-8075915745d4,17962,10,kidney,normal,blood;brain;intestine;kidney;liver;lung,Single-cell transcriptomics reveals gene expression dynamics of human fetal kidney development,10.1371/journal.pbio.3000152,Cells of the human fetal kidney,8dc29642-be06-46dc-a289-8075915745d4.h5ad,17962
8dc858b0-b076-4326-94bb-7c2d1cd721a3,8556,4,lung,normal,blood;brain;intestine;kidney;liver;lung,Early human lung immune cell development and its role in epithelial cell fate,10.1126/sciimmunol.adf9988,organoid,8dc858b0-b076-4326-94bb-7c2d1cd721a3.h5ad,8556
8e10f1c4-8e98-41e5-b65f-8cd89a887122,0,0,,,blood;brain;intestine;kidney;liver;lung,Human Brain Cell Atlas v1.0,10.1126/science.add7046,All neurons,8e10f1c4-8e98-41e5-b65f-8cd89a887122.h5ad,2480956
8e47ed12-c658-4252-b126-381df8d52a3d,0,0,,,blood;brain;intestine;kidney;liver;lung,Single-Cell Sequencing of Developing Human Gut Reveals Transcriptional Links to Childhood Crohn’s Disease,10.1016/j.devcel.2020.11.010,Paediatric Human Gut (4-14y),8e47ed12-c658-4252-b126-381df8d52a3d.h5ad,22502
8e5978bd-0e48-4a09-a92d-fa2985059f05,0,0,,,blood;brain;intestine;kidney;liver;lung,Exploring the Utility of snRNA-seq in Profiling Human Bladder Tissue: A Comprehensive Comparison with scRNA-seq,10.1016/j.isci.2024.111628,Adult bladder urothelial subset,8e5978bd-0e48-4a09-a92d-fa2985059f05.h5ad,14776
8e948521-3c3d-4e92-9ff1-3add0e069e41,0,0,,,blood;brain;intestine;kidney;liver;lung,Single cell RNA sequencing of the human embryonic meninges at 5-13 weeks post conception,,Fibroblasts,8e948521-3c3d-4e92-9ff1-3add0e069e41.h5ad,71657
8ef06ea4-8d0f-4303-a652-7d4604402b1f,0,0,,,blood;brain;intestine;kidney;liver;lung,Single cell atlas of the human ocular surface,,"scRNA-seq of human ocular surface: cornea, limbus, sclera – fetal data included",8ef06ea4-8d0f-4303-a652-7d4604402b1f.h5ad,815769
8f10185b-e0b3-46a5-8706-7f1799225d79,0,0,,,blood;brain;intestine;kidney;liver;lung,Single-cell transcriptomic atlas for adult human retina,10.1016/j.xgen.2023.100298,Bipolar cells in human retina,8f10185b-e0b3-46a5-8706-7f1799225d79.h5ad,53040
8f3e7fcf-0b16-4a29-a5f1-a7a8b267d689,0,0,,,blood;brain;intestine;kidney;liver;lung,Cellular heterogeneity and dynamics of the human uterus in healthy premenopausal women,10.1073/pnas.2404775121,All cells type from five healthy donors,8f3e7fcf-0b16-4a29-a5f1-a7a8b267d689.h5ad,50992
8f48c031-6692-4c82-b6c2-e4ad35cbc0aa,0,0,,,blood;brain;intestine;kidney;liver;lung,Human Brain Cell Atlas v1.0,10.1126/science.add7046,Supercluster: LAMP5-LHX6 and Chandelier,8f48c031-6692-4c82-b6c2-e4ad35cbc0aa.h5ad,45118
8f4f8502-9170-4ac2-9707-3b6985ebfe5f,0,0,,,blood;brain;intestine;kidney;liver;lung,Transcriptomic and spatial dissection of human ex vivo right atrial tissue reveals proinflammatory microvascular changes in ischemic heart disease,10.1016/j.xcrm.2024.101556,CAREBANK,8f4f8502-9170-4ac2-9707-3b6985ebfe5f.h5ad,221756
8faa2c07-0080-4627-b1d7-e645a780d752,0,0,,,blood;brain;intestine;kidney;liver;lung,"Single-Cell, Single-Nucleus, and Spatial RNA Sequencing of the Human Liver Identifies Cholangiocyte and Mesenchymal Heterogeneity",10.1002/hep4.1854,Healthy human liver: hepatocytes,8faa2c07-0080-4627-b1d7-e645a780d752.h5ad,50259
8fbed309-d3d4-441b-b3ff-e2dcbcec2d35,57918,21,lung,chronic obstructive pulmonary disease;normal,blood;brain;intestine;kidney;liver;lung,Anomalous Epithelial Variations and Ectopic Inflammatory Response in Chronic Obstructive Pulmonary Disease,10.1165/rcmb.2021-0555OC,Anomalous Epithelial Variations and Ectopic Inflammatory Response in Chronic Obstructive Pulmonary Disease,8fbed309-d3d4-441b-b3ff-e2dcbcec2d35.h5ad,57918
8fcf0ccc-67b2-43a3-90be-075f85169bef,0,0,,,blood;brain;intestine;kidney;liver;lung,SARS-CoV-2 receptor ACE2 and TMPRSS2 are primarily expressed in bronchial transient secretory cells,10.15252/embj.20105114,Airway,8fcf0ccc-67b2-43a3-90be-075f85169bef.h5ad,17451
8ff0cef9-393e-43de-9722-a1e12c239727,7750,10,blood,normal,blood;brain;intestine;kidney;liver;lung,Comparative Analysis of Commercial Single-Cell RNA Sequencing Technologies,10.1093/nar/gkae1186,Honeycomb-rep1,8ff0cef9-393e-43de-9722-a1e12c239727.h5ad,7750
900fdf13-150d-4695-9f8c-4c09105ba2eb,0,0,,,blood;brain;intestine;kidney;liver;lung,Human Brain Cell Atlas v1.0,10.1126/science.add7046,Dissection: Pons (Pn) - efferent nuclei of cranial nerves in pons - PnEN,900fdf13-150d-4695-9f8c-4c09105ba2eb.h5ad,47416
9038a71d-81a7-4bc7-82c2-186c26d5c3d6,0,0,,,blood;brain;intestine;kidney;liver;lung,Human skeletal muscle ageing atlas,10.1038/s43587-024-00613-3,MuSCs,9038a71d-81a7-4bc7-82c2-186c26d5c3d6.h5ad,17528
90d4a63b-5c02-43eb-acde-c49345681601,0,0,,,blood;brain;intestine;kidney;liver;lung,A molecular atlas of the human postmenopausal fallopian tube and ovary from single-cell RNA and ATAC sequencing,10.1016/j.celrep.2022.111838,Fallopian tube RNA,90d4a63b-5c02-43eb-acde-c49345681601.h5ad,60574
91b2327d-e3f3-4f63-b446-20774d20fc33,0,0,,,blood;brain;intestine;kidney;liver;lung,Comprehensive cell atlas of the first-trimester developing human brain,10.1126/science.adf1226,ClassOligo,91b2327d-e3f3-4f63-b446-20774d20fc33.h5ad,6190
91cc8f50-9c9e-4d9b-84fe-fcd59f852bba,0,0,,,blood;brain;intestine;kidney;liver;lung,Single-cell integration reveals metaplasia in inflammatory gut diseases,10.1038/s41586-024-07571-1,Healthy - Mesenchymal (first trimester),91cc8f50-9c9e-4d9b-84fe-fcd59f852bba.h5ad,117094
92161459-9103-4379-ae34-73a38eee1d1d,0,0,,,blood;brain;intestine;kidney;liver;lung,Single-cell genomic profiling of human dopamine neurons identifies a population that selectively degenerates in Parkinson’s disease,10.1038/s41593-022-01061-1,Human Nurr-Positive Nuclei 10x scRNA-seq,92161459-9103-4379-ae34-73a38eee1d1d.h5ad,80576
93091496-be48-4122-b945-9af9c22a7535,28718,1,brain,normal,blood;brain;intestine;kidney;liver;lung,HVS: Human variation study,10.1126/science.adf2359,Vip - neocortex: Human variation study (HVS),93091496-be48-4122-b945-9af9c22a7535.h5ad,28718
93131426-0124-4ab4-a013-9dfbcd99d467,0,0,,,blood;brain;intestine;kidney;liver;lung,Human Brain Cell Atlas v1.0,10.1126/science.add7046,Dissection: Epithalamus - ETH,93131426-0124-4ab4-a013-9dfbcd99d467.h5ad,24327
93325b5c-19bb-4481-aeda-738209650945,0,0,,,blood;brain;intestine;kidney;liver;lung,Human Oral and Craniofacial Cell Atlas,10.1101/2024.12.01.626279,Buccal and Labial Atlas,93325b5c-19bb-4481-aeda-738209650945.h5ad,29478
933497dc-7592-4532-9056-b9941547b3ac,0,0,,,blood;brain;intestine;kidney;liver;lung,A single-cell and spatially resolved atlas of human breast cancers,10.1038/s41588-021-00911-1,A single-cell and spatially-resolved atlas of human breast cancers - T_cells,933497dc-7592-4532-9056-b9941547b3ac.h5ad,35214
9372df2d-13d6-4fac-980b-919a5b7eb483,0,0,,,blood;brain;intestine;kidney;liver;lung,Human Brain Cell Atlas v1.0,10.1126/science.add7046,Dissection: Midbrain (M) - Periaqueductal gray and nearby nuclei - PAG,9372df2d-13d6-4fac-980b-919a5b7eb483.h5ad,33794
939d235c-50bd-41e1-83f5-d056d1aeae47,0,0,,,blood;brain;intestine;kidney;liver;lung,A spatial human thymus cell atlas mapped to a continuous tissue axis,10.1038/s41586-024-07944-6,thymus scRNA-seq atlas - B cell subset,939d235c-50bd-41e1-83f5-d056d1aeae47.h5ad,3460
93a3b257-359b-4266-b23f-64875d37a9e3,0,0,,,blood;brain;intestine;kidney;liver;lung,A spatial human thymus cell atlas mapped to a continuous tissue axis,10.1038/s41586-024-07944-6,thymus scRNA-seq atlas - fibroblast subset,93a3b257-359b-4266-b23f-64875d37a9e3.h5ad,20779
93cb76aa-a84b-4a92-8e6c-66a914e26d4c,0,0,,,blood;brain;intestine;kidney;liver;lung,Transcriptomic cytoarchitecture reveals principles of human neocortex organization,10.1126/science.adf6812,Dissection: Primary somatosensory cortex (S1),93cb76aa-a84b-4a92-8e6c-66a914e26d4c.h5ad,153159
9434b020-de42-43eb-bcc4-542b2be69015,0,0,,,blood;brain;intestine;kidney;liver;lung,Pathogenic variants damage cell composition and single cell transcription in cardiomyopathies,10.1126/science.abo1984,DCM/ACM heart cell atlas: Macrophages,9434b020-de42-43eb-bcc4-542b2be69015.h5ad,59217
94423ec1-21f8-40e8-b5c9-c3ea82350ca4,0,0,,,blood;brain;intestine;kidney;liver;lung,Single-cell RNA sequencing unifies developmental programs of Esophageal and Gastric Intestinal Metaplasia,10.1158/2159-8290.cd-22-0824,UMAP of Myeloid cells,94423ec1-21f8-40e8-b5c9-c3ea82350ca4.h5ad,3282
949573c7-2610-450d-8aaa-d4de4842901c,0,0,,,blood;brain;intestine;kidney;liver;lung,Human subcutaneous and visceral adipocyte atlases uncover classical and non-classical adipocytes and depot-specific patterns,10.1038/s41588-024-02048-3,snRNA-seq of human visceral adipose tissue - adipocytes integrated with emont et al,949573c7-2610-450d-8aaa-d4de4842901c.h5ad,26935
949ec7fc-ac54-47c9-bb6f-ee9e67688cce,0,0,,,blood;brain;intestine;kidney;liver;lung,Human Brain Cell Atlas v1.0,10.1126/science.add7046,Dissection: Cerebral cortex (Cx) - Short insular gyri - Granular insular cortex - Ig,949ec7fc-ac54-47c9-bb6f-ee9e67688cce.h5ad,38937
94c41723-b2c4-4b59-a49a-64c9b851903e,0,0,,,blood;brain;intestine;kidney;liver;lung,Resolving cellular and molecular diversity along the hippocampal anterior-to-posterior axis in humans,10.1016/j.neuron.2021.05.003,snRNA-seq of human anterior and posterior hippocampus,94c41723-b2c4-4b59-a49a-64c9b851903e.h5ad,129905
95ce06a0-7de9-4ab2-bcd1-a6625f55e7e3,0,0,,,blood;brain;intestine;kidney;liver;lung,Single cell atlas of the human retina,10.1101/2023.11.07.566105,snRNA-seq of human retina - retinal ganglion cell subset,95ce06a0-7de9-4ab2-bcd1-a6625f55e7e3.h5ad,372816
95d3b0fb-b8a7-4bec-a2e8-cded3222ff07,0,0,,,blood;brain;intestine;kidney;liver;lung,Single-nucleus transcriptome analysis reveals cell-type-specific molecular signatures across reward circuitry in the human brain,10.1016/j.neuron.2021.09.001,HPC region,95d3b0fb-b8a7-4bec-a2e8-cded3222ff07.h5ad,10268
960ecd06-e7c2-463d-9a5b-6832994376c6,0,0,,,blood;brain;intestine;kidney;liver;lung,Multimodal profiling reveals tissue-directed signatures of human immune cells altered with age,10.1038/s41590-025-02241-4,Immune aging project - t cell subset,960ecd06-e7c2-463d-9a5b-6832994376c6.h5ad,610429
9613ef7c-dec7-4d68-acbe-1ffa7f57fde5,0,0,,,blood;brain;intestine;kidney;liver;lung,Profiling of epithelial functional states and fibroblast phenotypes in hormone therapy-naïve localised prostate cancer,10.1101/2024.10.23.619925,Single-cell atlas of 24 hormone therapy naive localised prostate cancers -- T-cells subset,9613ef7c-dec7-4d68-acbe-1ffa7f57fde5.h5ad,19033
963a08cb-d995-4862-9614-f9d38a7d7540,0,0,,,blood;brain;intestine;kidney;liver;lung,Single Cell Multiome Atlas of the Human Fetal Retina,10.1038/s41467-024-50853-5,snRNA-seq of the developing human retina,963a08cb-d995-4862-9614-f9d38a7d7540.h5ad,226506
965386e9-1e4f-466d-bf59-ebdca4b66b9b,0,0,,,blood;brain;intestine;kidney;liver;lung,Single cell RNA sequencing of bone marrow mononuclear cells from healthy donors and B-cell lymphoma patients following CD19 CAR T-cell therapy,10.1016/j.xcrm.2023.101158,Single cell RNA sequencing of bone marrow mononuclear cells from healthy donors and B-cell lymphoma patients following CD19 CAR T-cell therapy,965386e9-1e4f-466d-bf59-ebdca4b66b9b.h5ad,92676
968885c5-b652-48d9-9006-c34b5fc1c07a,0,0,,,blood;brain;intestine;kidney;liver;lung,Mapping the temporal and spatial dynamics of the human endometrium in vivo and in vitro,10.1038/s41588-021-00972-2,Non-pregnant Uterus (Endometrium - Epithelial),968885c5-b652-48d9-9006-c34b5fc1c07a.h5ad,10729
96a3f64b-0ee9-40d8-91e9-813ce38261c9,0,0,,,blood;brain;intestine;kidney;liver;lung,A Web Portal and Workbench for Biological Dissection of Single Cell COVID-19 Host Responses,10.1016/j.isci.2021.103115,COVID-19 Immune Altas: Integration of 5 public COVID-19 PBMC single-cell datasets,96a3f64b-0ee9-40d8-91e9-813ce38261c9.h5ad,239696
96baf2e0-60c5-48cf-b1d1-cba657851507,0,0,,,blood;brain;intestine;kidney;liver;lung,Human subcutaneous and visceral adipocyte atlases uncover classical and non-classical adipocytes and depot-specific patterns,10.1038/s41588-024-02048-3,snRNA-seq of human visceral adipose tissue - all cells,96baf2e0-60c5-48cf-b1d1-cba657851507.h5ad,83731
975e13b6-bec1-4eed-b46a-9be1f1357373,0,0,,,blood;brain;intestine;kidney;liver;lung,Human breast cell atlas,10.1038/s41588-024-01688-9,HBCA - epithelial,975e13b6-bec1-4eed-b46a-9be1f1357373.h5ad,352496
975fd2d3-1982-47a1-9ef7-8cde3345f219,0,0,,,blood;brain;intestine;kidney;liver;lung,Single cell atlas of the human retina,10.1101/2023.11.07.566105,snRNA-seq of human retina - bipolar cell subset,975fd2d3-1982-47a1-9ef7-8cde3345f219.h5ad,691008
