dataset_id,cell_count,unique_cell_types,tissues,diseases,tissue_general_query,collection_name,collection_doi,dataset_title,dataset_h5ad_path,dataset_total_cell_count
c35a95de-e54c-46c0-855f-984f21163279,0,0,,,blood;brain;intestine;kidney;liver;lung,Cellular heterogeneity and dynamics of the human uterus in healthy premenopausal women,10.1073/pnas.2404775121,Blood endothelial cells from integrated dataset of 20 donors,c35a95de-e54c-46c0-855f-984f21163279.h5ad,16119
c3aa4f95-7a18-4a7d-8dd8-ca324d714363,0,0,,,blood;brain;intestine;kidney;liver;lung,Transcriptomic cytoarchitecture reveals principles of human neocortex organization,10.1126/science.adf6812,Supercluster: IT-projecting excitatory neurons,c3aa4f95-7a18-4a7d-8dd8-ca324d714363.h5ad,638941
c3d381b2-3104-444e-8ad5-d3524407bbb6,0,0,,,blood;brain;intestine;kidney;liver;lung,Integration of eQTL and a Single-Cell Atlas in the Human Eye Identifies Causal Genes for Age-Related Macular Degeneration,10.1016/j.celrep.2019.12.082,Horizontal cells of human eye,c3d381b2-3104-444e-8ad5-d3524407bbb6.h5ad,1875
c3fe3c1e-5bf8-4678-b74a-79899243ad41,0,0,,,blood;brain;intestine;kidney;liver;lung,A Cellular Anatomy of the Normal Adult Human Prostate and Prostatic Urethra,10.1016/j.celrep.2018.11.086,A Cellular Anatomy of the Normal Adult Human Prostate and Prostatic Urethra - All Human Cells,c3fe3c1e-5bf8-4678-b74a-79899243ad41.h5ad,28702
c42c8ad3-9761-49e5-b9bf-ee8ebd50416f,0,0,,,blood;brain;intestine;kidney;liver;lung,Spatiotemporal analysis of human intestinal development at single-cell resolution,10.1016/j.cell.2020.12.016,Spatiotemporal analysis of human intestinal development at single-cell resolution: Endothelium,c42c8ad3-9761-49e5-b9bf-ee8ebd50416f.h5ad,4154
c4b03352-af8d-492a-8d6b-40f304e0a122,0,0,,,blood;brain;intestine;kidney;liver;lung,Human Brain Cell Atlas v1.0,10.1126/science.add7046,Supercluster: Medium spiny neuron,c4b03352-af8d-492a-8d6b-40f304e0a122.h5ad,152189
c4dd26a8-d956-4bee-a233-44b573f2ce27,0,0,,,blood;brain;intestine;kidney;liver;lung,Human Brain Cell Atlas v1.0,10.1126/science.add7046,Dissection: Body of hippocampus (HiB) - Rostral CA1-2,c4dd26a8-d956-4bee-a233-44b573f2ce27.h5ad,11265
c52de62a-058d-4d78-a464-bdf552378f43,0,0,,,blood;brain;intestine;kidney;liver;lung,Spatiotemporal immune zonation of the human kidney,10.1126/science.aat5031,Fetal kidney dataset: stroma,c52de62a-058d-4d78-a464-bdf552378f43.h5ad,8345
c54c9659-1b6b-4d4a-96f0-7dc987410f2d,7750,10,blood,normal,blood;brain;intestine;kidney;liver;lung,Comparative Analysis of Commercial Single-Cell RNA Sequencing Technologies,10.1093/nar/gkae1186,10X_3-rep1,c54c9659-1b6b-4d4a-96f0-7dc987410f2d.h5ad,7750
c5cfa2b7-abb1-4a50-908f-707b54ca606b,0,0,,,blood;brain;intestine;kidney;liver;lung,Human Brain Cell Atlas v1.0,10.1126/science.add7046,Dissection: Midbrain (M) - Periaqueductal gray and Dorsal raphe nucleus - PAG-DR,c5cfa2b7-abb1-4a50-908f-707b54ca606b.h5ad,14094
c5d88abe-f23a-45fa-a534-788985e93dad,0,0,,,blood;brain;intestine;kidney;liver;lung,Tabula Sapiens,10.1126/science.abl4896,Tabula Sapiens - Immune,c5d88abe-f23a-45fa-a534-788985e93dad.h5ad,592317
c6413315-7158-46c5-a5fd-7228385694f1,0,0,,,blood;brain;intestine;kidney;liver;lung,Cellular heterogeneity of human fallopian tubes in normal and hydrosalpinx disease states identified by scRNA-seq,10.1101/2021.09.16.460628,scRNA-seq analysis of healthy human fallopian tubes,c6413315-7158-46c5-a5fd-7228385694f1.h5ad,59738
c76098ba-eed3-45b1-98f2-96fcac55ed18,0,0,,,blood;brain;intestine;kidney;liver;lung,SEA-AD: Seattle Alzheimer’s Disease Brain Cell Atlas,10.1038/s41593-024-01774-5,Microglia-PVM - MTG: Seattle Alzheimer's Disease Atlas (SEA-AD),c76098ba-eed3-45b1-98f2-96fcac55ed18.h5ad,40000
c7775e88-49bf-4ba2-a03b-93f00447c958,647366,46,blood,COVID-19;normal;respiratory system disorder,blood;brain;intestine;kidney;liver;lung,Single-cell multi-omics analysis of the immune response in COVID-19,10.1038/s41591-021-01329-2,Single-cell multi-omics analysis of the immune response in COVID-19,c7775e88-49bf-4ba2-a03b-93f00447c958.h5ad,647366
c7856243-c59a-4b70-8ce7-25b94c2d9da1,0,0,,,blood;brain;intestine;kidney;liver;lung,Human Brain Cell Atlas v1.0,10.1126/science.add7046,Dissection: Cerebral cortex (Cx) - Gyrus rectus (ReG) - Medial orbitofrontal cortex - A14,c7856243-c59a-4b70-8ce7-25b94c2d9da1.h5ad,14352
c7d0def0-2dcd-4111-902b-67e6baeac119,0,0,,,blood;brain;intestine;kidney;liver;lung,HTAN/HTAPP Broad - Spatio-molecular dissection of the breast cancer metastatic microenvironment,10.1038/s41591-024-03215-z,HTAPP-880-SMP-7179 scRNA-seq,c7d0def0-2dcd-4111-902b-67e6baeac119.h5ad,10918
c838aec3-03ef-4398-b882-0e3912abfff0,1265624,32,blood,normal,blood;brain;intestine;kidney;liver;lung,Asian Immune Diversity Atlas (AIDA),10.1016/j.cell.2025.02.017,"AIDA Phase 1 Data Freeze v2: Chinese, Indian, Japanese, Korean, Malay, and Thai donors in Japan, Singapore, South Korea, Thailand, and India",c838aec3-03ef-4398-b882-0e3912abfff0.h5ad,1265624
c874f155-9bf9-4928-b821-f52c876b3e48,4603,8,blood,COVID-19,blood;brain;intestine;kidney;liver;lung,Longitudinal profiling of respiratory and systemic immune responses reveals myeloid cell-driven lung inflammation in severe COVID-19,10.1016/j.immuni.2021.03.005,49 years old male - Fresh PBMCs (1 day post-intubation),c874f155-9bf9-4928-b821-f52c876b3e48.h5ad,4603
c888b684-6c51-431f-972a-6c963044cef0,0,0,,,blood;brain;intestine;kidney;liver;lung,"Harmonized single-cell landscape, intercellular crosstalk and tumor architecture of glioblastoma",10.1101/2022.08.27.505439,Core GBmap,c888b684-6c51-431f-972a-6c963044cef0.h5ad,338564
c893ddc3-f25b-45e2-8c9e-155918b4261c,0,0,,,blood;brain;intestine;kidney;liver;lung,Transcriptional responses of the human dorsal striatum in opioid use disorder implicates cell type-specifc programs,10.1038/s41467-024-45165-7,Transcriptional responses of the human dorsal striatum in opioid use disorder implicates cell type-specifc programs,c893ddc3-f25b-45e2-8c9e-155918b4261c.h5ad,98848
c8d40d53-387b-48f2-9f89-72bfdb9c7c9f,0,0,,,blood;brain;intestine;kidney;liver;lung,A spatially resolved single cell genomic atlas of the adult human breast,10.1038/s41586-023-06252-9,scRNA-seq data - perivascular cells,c8d40d53-387b-48f2-9f89-72bfdb9c7c9f.h5ad,52638
c8f83821-a242-4ed7-86e9-7da077f5d348,0,0,,,blood;brain;intestine;kidney;liver;lung,"Brain matters: Unveiling the Distinct Contributions of Region, Age, and Sex to Glia diversity and CNS Function",10.1186/s40478-023-01568-z,white matter - astrocytes,c8f83821-a242-4ed7-86e9-7da077f5d348.h5ad,3596
ca20e2ac-5676-4158-b5d0-0c2b15898b19,0,0,,,blood;brain;intestine;kidney;liver;lung,Human Brain Cell Atlas v1.0,10.1126/science.add7046,Dissection: Basal nuclei (BN) - Globus pallidus (GP) - Internal segment of globus pallidus - GPi,ca20e2ac-5676-4158-b5d0-0c2b15898b19.h5ad,33968
ca46ffe6-0a26-4d8d-82fa-81722daf1102,0,0,,,blood;brain;intestine;kidney;liver;lung,A single-cell atlas of human and mouse white adipose tissue,10.1038/s41586-022-04518-2,A Single-Cell Atlas of Human White Adipose Tissue,ca46ffe6-0a26-4d8d-82fa-81722daf1102.h5ad,166149
cab0bc48-744c-461b-aaf4-7bf2cb7af00d,5080,7,blood,COVID-19,blood;brain;intestine;kidney;liver;lung,Longitudinal profiling of respiratory and systemic immune responses reveals myeloid cell-driven lung inflammation in severe COVID-19,10.1016/j.immuni.2021.03.005,74 years old female - Fresh PBMCs (4 days post-intubation),cab0bc48-744c-461b-aaf4-7bf2cb7af00d.h5ad,5080
cac02b79-9f54-4668-9235-60d3b76a4197,0,0,,,blood;brain;intestine;kidney;liver;lung,Cellular heterogeneity of human fallopian tubes in normal and hydrosalpinx disease states identified by scRNA-seq,10.1101/2021.09.16.460628,scRNA-seq analysis of non-ciliated epithelial cells of healthy human fallopian tubes,cac02b79-9f54-4668-9235-60d3b76a4197.h5ad,14285
caf8670f-e647-4f0c-bfba-163aa84ce602,0,0,,,blood;brain;intestine;kidney;liver;lung,Human Brain Cell Atlas v1.0,10.1126/science.add7046,Supercluster: Deep-layer corticothalamic and 6b,caf8670f-e647-4f0c-bfba-163aa84ce602.h5ad,78396
cb252df6-6e49-4553-abd1-495a00006fb1,0,0,,,blood;brain;intestine;kidney;liver;lung,Human Oral and Craniofacial Cell Atlas,10.1101/2024.12.01.626279,Oral and Craniofacial Atlas,cb252df6-6e49-4553-abd1-495a00006fb1.h5ad,246103
cbd3d76b-eec6-42e5-a8fb-71dc825e2a74,0,0,,,blood;brain;intestine;kidney;liver;lung,Single-cell integration reveals metaplasia in inflammatory gut diseases,10.1038/s41586-024-07571-1,Healthy - Mesenchymal (second trimester),cbd3d76b-eec6-42e5-a8fb-71dc825e2a74.h5ad,94952
cbec7853-d996-4493-bbf8-5d82857a4e51,0,0,,,blood;brain;intestine;kidney;liver;lung,Automatic cell-type harmonization and integration across Human Cell Atlas datasets,10.1016/j.cell.2023.11.026,Intestine,cbec7853-d996-4493-bbf8-5d82857a4e51.h5ad,263275
cc47b200-9c67-452f-990c-f84d3b33b990,0,0,,,blood;brain;intestine;kidney;liver;lung,Single cell atlas of the human optic nerve,,snRNA-seq of human optic nerve and optic nerve head - oligodendrocytes,cc47b200-9c67-452f-990c-f84d3b33b990.h5ad,278040
ccfdcad0-7104-46b9-addf-fd66a2a15907,0,0,,,blood;brain;intestine;kidney;liver;lung,Cell Types of the Human Retina and Its Organoids at Single-Cell Resolution,10.1016/j.cell.2020.08.013,Periphery - Cell Types of the Human Retina and Its Organoids at Single-Cell Resolution,ccfdcad0-7104-46b9-addf-fd66a2a15907.h5ad,34723
cd2f23c1-aef1-48ae-8eb4-0bcf124e567d,0,0,,,blood;brain;intestine;kidney;liver;lung,A Balanced Bone Marrow Reference Map of Hematopoietic Development,10.1158/2643-3230.BCD-24-0342,A (Balanced) Bone Marrow Reference Map of Hematopoietic Development,cd2f23c1-aef1-48ae-8eb4-0bcf124e567d.h5ad,263159
cd4c96bb-ad66-4e83-ba9e-a7df8790eb12,0,0,,,blood;brain;intestine;kidney;liver;lung,Single-cell proteo-genomic reference maps of the hematopoietic system enable the purification and massive profiling of precisely defined cell states,10.1038/s41590-021-01059-0,3 healthy young and 3 healthy old bone marrow donors (Reference sample),cd4c96bb-ad66-4e83-ba9e-a7df8790eb12.h5ad,49057
cd6398a9-c0af-4467-9091-c536866535bd,0,0,,,blood;brain;intestine;kidney;liver;lung,HTAN/HTAPP Broad - Spatio-molecular dissection of the breast cancer metastatic microenvironment,10.1038/s41591-024-03215-z,HTAPP-944-SMP-7479 scRNA-seq,cd6398a9-c0af-4467-9091-c536866535bd.h5ad,10016
cd77258f-b08b-4c89-b93f-6e6f146b1a4d,0,0,,,blood;brain;intestine;kidney;liver;lung,Molecular characterization of selectively vulnerable neurons in Alzheimer's Disease,10.1038/s41593-020-00764-7,Molecular characterization of selectively vulnerable neurons in Alzheimer’s Disease: EC excitatory neurons,cd77258f-b08b-4c89-b93f-6e6f146b1a4d.h5ad,8362
cda2c8cd-be1c-42e5-b2cd-162caa1c4ce7,0,0,,,blood;brain;intestine;kidney;liver;lung,A cell atlas of human thymic development defines T cell repertoire formation,10.1126/science.aay3224,Figure 1 - A cell atlas of human thymic development defines T cell repertoire formation,cda2c8cd-be1c-42e5-b2cd-162caa1c4ce7.h5ad,255901
cda48edf-331d-4ada-96ea-104ccb3147dd,0,0,,,blood;brain;intestine;kidney;liver;lung,A single-cell atlas of human and mouse white adipose tissue,10.1038/s41586-022-04518-2,A Single-Cell Atlas of Human White Adipose Tissue - Human vascular cells,cda48edf-331d-4ada-96ea-104ccb3147dd.h5ad,22734
cdefb878-7f00-4b9d-9eda-b3652cfac0c8,0,0,,,blood;brain;intestine;kidney;liver;lung,A human fetal lung cell atlas uncovers proximal-distal gradients of differentiation and key regulators of epithelial fates,10.1016/j.cell.2022.11.005,Cilium,cdefb878-7f00-4b9d-9eda-b3652cfac0c8.h5ad,1641
ce009dc1-ac57-4386-b72f-5c575701c253,0,0,,,blood;brain;intestine;kidney;liver;lung,Longitudinal profiling of respiratory and systemic immune responses reveals myeloid cell-driven lung inflammation in severe COVID-19,10.1016/j.immuni.2021.03.005,74 years old female - Airway Wash (6 days post-intubation),ce009dc1-ac57-4386-b72f-5c575701c253.h5ad,2834
ce5132bd-7600-4299-bb2c-2b00d409170f,0,0,,,blood;brain;intestine;kidney;liver;lung,Single cell RNA sequencing of the human embryonic meninges at 5-13 weeks post conception,,Vascular_perivascular,ce5132bd-7600-4299-bb2c-2b00d409170f.h5ad,7155
cec9f9a5-8832-437d-99af-fb8237cde54b,0,0,,,blood;brain;intestine;kidney;liver;lung,Integration of eQTL and a Single-Cell Atlas in the Human Eye Identifies Causal Genes for Age-Related Macular Degeneration,10.1016/j.celrep.2019.12.082,Retinal ganglion cells of human eye,cec9f9a5-8832-437d-99af-fb8237cde54b.h5ad,1777
cee11228-9f0b-4e57-afe2-cfe15ee56312,0,0,,,blood;brain;intestine;kidney;liver;lung,Tabula Sapiens,10.1126/science.abl4896,Tabula Sapiens - Spleen,cee11228-9f0b-4e57-afe2-cfe15ee56312.h5ad,70448
cee9b331-3ba0-4461-8bbd-867819d9fc0a,7750,10,blood,normal,blood;brain;intestine;kidney;liver;lung,Comparative Analysis of Commercial Single-Cell RNA Sequencing Technologies,10.1093/nar/gkae1186,10X_FRP-rep1,cee9b331-3ba0-4461-8bbd-867819d9fc0a.h5ad,7750
cf83c98a-3791-4537-bbde-a719f6d73c13,128588,17,blood,B-cell acute lymphoblastic leukemia,blood;brain;intestine;kidney;liver;lung,"HTAN-CHOP - Single-cell multiomics reveals increased plasticity, resistant populations, and stem-cell–like blasts in KMT2A-rearranged leukemia",10.1182/blood.2021013442,Global dataset of infant KMT2Ar B-ALL,cf83c98a-3791-4537-bbde-a719f6d73c13.h5ad,128588
cfa3c355-ee77-4fc8-9a00-78e61d23024c,0,0,,,blood;brain;intestine;kidney;liver;lung,A single-cell transcriptional roadmap of the mouse and human lymph node lymphatic vasculature,10.3389/fcvm.2020.00052,A Single-Cell Transcriptional Roadmap of the Mouse and Human Lymph Node Lymphatic Vasculature - human,cfa3c355-ee77-4fc8-9a00-78e61d23024c.h5ad,4355
cfa755c1-48c5-4336-94f4-aa95eca4fbd5,0,0,,,blood;brain;intestine;kidney;liver;lung,Human Brain Cell Atlas v1.0,10.1126/science.add7046,Supercluster: Choroid plexus,cfa755c1-48c5-4336-94f4-aa95eca4fbd5.h5ad,7689
cfcec0ab-909c-4334-9683-b275e0b4dcc0,0,0,,,blood;brain;intestine;kidney;liver;lung,A spatial human thymus cell atlas mapped to a continuous tissue axis,10.1038/s41586-024-07944-6,thymus scRNA-seq atlas - T cell subset,cfcec0ab-909c-4334-9683-b275e0b4dcc0.h5ad,391462
cff99df2-4904-44f7-9173-ff837f95606e,0,0,,,blood;brain;intestine;kidney;liver;lung,Molecular Signatures of Resilience to Alzheimer’s Disease in Neocortical Layer 4 Neurons,10.1101/2024.11.03.621787,all cells,cff99df2-4904-44f7-9173-ff837f95606e.h5ad,424528
d01c9dff-abd1-4825-bf30-2eb2ba74597e,0,0,,,blood;brain;intestine;kidney;liver;lung,Transcriptomic cytoarchitecture reveals principles of human neocortex organization,10.1126/science.adf6812,Supercluster: Deep layer (non-IT) excitatory neurons,d01c9dff-abd1-4825-bf30-2eb2ba74597e.h5ad,92969
d02287f3-408b-438d-9131-999e460cbd0e,0,0,,,blood;brain;intestine;kidney;liver;lung,Human Brain Cell Atlas v1.0,10.1126/science.add7046,Dissection: Paleocortex (PalCx) - Piriform cortex - Pir,d02287f3-408b-438d-9131-999e460cbd0e.h5ad,36941
d0c12af4-c0e4-4c7b-873a-70752b449689,0,0,,,blood;brain;intestine;kidney;liver;lung,Mapping the developing human immune system across organs,10.1126/science.abo0510,Stromal cells (all non-immune cells),d0c12af4-c0e4-4c7b-873a-70752b449689.h5ad,318656
d0ea3ec4-0f3b-4649-9146-1c0b5f303a55,0,0,,,blood;brain;intestine;kidney;liver;lung,SEA-AD: Seattle Alzheimer’s Disease Brain Cell Atlas,10.1038/s41593-024-01774-5,L6b - DLPFC: Seattle Alzheimer's Disease Atlas (SEA-AD),d0ea3ec4-0f3b-4649-9146-1c0b5f303a55.h5ad,18903
d1207c81-7309-43a7-a5a0-f4283670b62b,0,0,,,blood;brain;intestine;kidney;liver;lung,A molecular atlas of the human postmenopausal fallopian tube and ovary from single-cell RNA and ATAC sequencing,10.1016/j.celrep.2022.111838,Ovary RNA,d1207c81-7309-43a7-a5a0-f4283670b62b.h5ad,26134
d18736c3-6292-4379-919a-d6d973204c87,108717,15,blood,normal;rheumatoid arthritis,blood;brain;intestine;kidney;liver;lung,Single-cell RNA-seq analysis reveals cell subsets and gene signatures associated with Rheumatoid Arthritis Disease Activity,10.1172/jci.insight.178499,Single-cell RNA-seq analysis reveals cell subsets and gene signatures associated with Rheumatoid Arthritis Disease Activity,d18736c3-6292-4379-919a-d6d973204c87.h5ad,108717
d1cbed97-d88f-4954-8925-13302fe30b39,0,0,,,blood;brain;intestine;kidney;liver;lung,Spatial proteogenomics reveals distinct and evolutionarily conserved hepatic macrophage niches,10.1016/j.cell.2021.12.018,CD45 negative cells from human liver dataset,d1cbed97-d88f-4954-8925-13302fe30b39.h5ad,15481
d224c8e0-c28e-4360-9e42-b3977cd83f9f,0,0,,,blood;brain;intestine;kidney;liver;lung,HTAN MSK - Single cell profiling reveals novel tumor and myeloid subpopulations in small cell lung cancer,10.1016/j.ccell.2021.09.008,Mesenchymal cells,d224c8e0-c28e-4360-9e42-b3977cd83f9f.h5ad,8030
d2514440-d747-4d8d-b2c7-b58ef8b71fbe,0,0,,,blood;brain;intestine;kidney;liver;lung,Human Brain Cell Atlas v1.0,10.1126/science.add7046,Dissection: Thalamus (THM) - posterior nuclear complex of thalamus (PoN) - lateral geniculate nucleus (LG),d2514440-d747-4d8d-b2c7-b58ef8b71fbe.h5ad,48856
d288b10a-643e-44bd-b451-96e9588b2ee5,0,0,,,blood;brain;intestine;kidney;liver;lung,Human Brain Cell Atlas v1.0,10.1126/science.add7046,Dissection: Cerebral cortex (Cx) - Supramarginal gyrus (SMG) - A40,d288b10a-643e-44bd-b451-96e9588b2ee5.h5ad,39053
d2b5efc1-14c6-4b5f-bd98-40f9084872d7,0,0,,,blood;brain;intestine;kidney;liver;lung,Human Brain Cell Atlas v1.0,10.1126/science.add7046,Dissection: Tail of Hippocampus (HiT) - Caudal Hippocampus - CA1-CA3,d2b5efc1-14c6-4b5f-bd98-40f9084872d7.h5ad,36886
d2bc2703-a9b5-4949-b85d-61da7b9961b1,0,0,,,blood;brain;intestine;kidney;liver;lung,Smoking modulates different secretory subpopulations expressing SARS-CoV-2 entry genes in the nasal and bronchial airways,10.1038/s41598-022-17832-6,Bronchial scRNA-Seq Dataset,d2bc2703-a9b5-4949-b85d-61da7b9961b1.h5ad,2075
d2fc9880-e6d3-4922-af5c-61f4f517adfa,0,0,,,blood;brain;intestine;kidney;liver;lung,SEA-AD: Seattle Alzheimer’s Disease Brain Cell Atlas,10.1038/s41593-024-01774-5,Oligodendrocyte - MTG: Seattle Alzheimer's Disease Atlas (SEA-AD),d2fc9880-e6d3-4922-af5c-61f4f517adfa.h5ad,111194
d319af7f-be2e-441e-8caa-3b8a88480e89,0,0,,,blood;brain;intestine;kidney;liver;lung,Cell Atlas of The Human Fovea and Peripheral Retina,10.1038/s41598-020-66092-9,Retinal ganglion cells of the human fovea and peripheral retina,d319af7f-be2e-441e-8caa-3b8a88480e89.h5ad,11404
d3566d6a-a455-4a15-980f-45eb29114cab,7145,30,blood,normal,blood;brain;intestine;kidney;liver;lung,Single-cell proteo-genomic reference maps of the hematopoietic system enable the purification and massive profiling of precisely defined cell states,10.1038/s41590-021-01059-0,blood and bone marrow from a healthy young donor,d3566d6a-a455-4a15-980f-45eb29114cab.h5ad,15502
d3a83885-5198-4b04-8314-b753b66ef9a8,0,0,,,blood;brain;intestine;kidney;liver;lung,Single cell analysis of mouse and human prostate reveals novel fibroblasts with specialized distribution and microenvironment interactions,10.1002/path.5751,Single cell analysis of mouse and human prostate reveals novel fibroblasts with specialized distribution and microenvironment interactions - Human Leukocyte Cells,d3a83885-5198-4b04-8314-b753b66ef9a8.h5ad,19037
d3cb449b-c2b1-4b50-a7f1-21203535fe61,0,0,,,blood;brain;intestine;kidney;liver;lung,A multi-region single nucleus transcriptomic atlas of Parkinson’s disease,10.1038/s41597-024-04117-y,Parkinson's disease,d3cb449b-c2b1-4b50-a7f1-21203535fe61.h5ad,2096155
d3d4baff-d142-4f13-acc6-96a4ef6a3e95,0,0,,,blood;brain;intestine;kidney;liver;lung,Cellular atlas of the human ovary using morphologically guided spatial transcriptomics and single-cell sequencing,10.1126/sciadv.adm7506,Ovarian tissue from donor 5,d3d4baff-d142-4f13-acc6-96a4ef6a3e95.h5ad,6339
d41f45c1-1b7b-4573-a998-ac5c5acb1647,82991,8,lung,lung adenocarcinoma,blood;brain;intestine;kidney;liver;lung,HTAN MSK - Transcriptional connectivity of regulatory T cells in the tumor microenvironment informs novel combination cancer therapy strategies,10.1038/s41590-023-01504-2,Transcriptional connectivity of regulatory T cells in the tumor microenvironment informs novel combination cancer therapy strategies,d41f45c1-1b7b-4573-a998-ac5c5acb1647.h5ad,82991
d42cadbf-b907-49dc-9565-fedba8fccedc,0,0,,,blood;brain;intestine;kidney;liver;lung,Cellular heterogeneity and dynamics of the human uterus in healthy premenopausal women,10.1073/pnas.2404775121,Blood endothelial cells from five healthy donors,d42cadbf-b907-49dc-9565-fedba8fccedc.h5ad,8678
d45aca3a-ddb8-4185-a462-eff1e0c7af2e,0,0,,,blood;brain;intestine;kidney;liver;lung,Tabula Sapiens,10.1126/science.abl4896,Tabula Sapiens - Ear,d45aca3a-ddb8-4185-a462-eff1e0c7af2e.h5ad,3055
d4cfefa0-3a35-44eb-b848-d7a725b481e7,0,0,,,blood;brain;intestine;kidney;liver;lung,HTAN MSK - Single cell profiling reveals novel tumor and myeloid subpopulations in small cell lung cancer,10.1016/j.ccell.2021.09.008,NSCLC epithelial cells,d4cfefa0-3a35-44eb-b848-d7a725b481e7.h5ad,9778
d4e69e01-3ba2-4d6b-a15d-e7048f78f22e,0,0,,,blood;brain;intestine;kidney;liver;lung,Cells of the adult human heart,10.1038/s41586-020-2797-4,All — Cells of the adult human heart,d4e69e01-3ba2-4d6b-a15d-e7048f78f22e.h5ad,486134
d5452b83-7c3d-4d7c-ab7a-c7fece7196c5,0,0,,,blood;brain;intestine;kidney;liver;lung,Human Brain Cell Atlas v1.0,10.1126/science.add7046,Dissection: Body of hippocampus (HiB) - Rostral CA3,d5452b83-7c3d-4d7c-ab7a-c7fece7196c5.h5ad,8077
d567b692-c374-4628-a508-8008f6778f22,0,0,,,blood;brain;intestine;kidney;liver;lung,Spatially resolved multiomics of human cardiac niches,10.1038/s41586-023-06311-1,Combined single cell and single nuclei RNA-Seq data - Heart Global,d567b692-c374-4628-a508-8008f6778f22.h5ad,704296
d582f63a-3c88-4e38-8cd3-8682dbe40f64,0,0,,,blood;brain;intestine;kidney;liver;lung,Human Brain Cell Atlas v1.0,10.1126/science.add7046,Dissection: Cerebral cortex (Cx) - Posterior intermediate orbital gyrus (POrG) - Caudal division of OFCi - A13,d582f63a-3c88-4e38-8cd3-8682dbe40f64.h5ad,34919
d5a2d011-3765-4dad-ac36-3fff087589fe,8093,1,brain,normal,blood;brain;intestine;kidney;liver;lung,HVS: Human variation study,10.1126/science.adf2359,Lamp5 - neocortex: Human variation study (HVS),d5a2d011-3765-4dad-ac36-3fff087589fe.h5ad,8093
d5c67a4e-a8d9-456d-a273-fa01adb1b308,0,0,,,blood;brain;intestine;kidney;liver;lung,A single-cell transcriptome atlas of the adult human retina,10.15252/embj.2018100811,Retina,d5c67a4e-a8d9-456d-a273-fa01adb1b308.h5ad,19694
d6505c89-c43d-4c28-8c4f-7351a5fd5528,0,0,,,blood;brain;intestine;kidney;liver;lung,Single cell atlas of the human retina,10.1101/2023.11.07.566105,snRNA-seq of human retina - all cells,d6505c89-c43d-4c28-8c4f-7351a5fd5528.h5ad,3177310
d661aeb3-5bf7-497d-832f-2399a1ef9b63,0,0,,,blood;brain;intestine;kidney;liver;lung,Single-cell integration reveals metaplasia in inflammatory gut diseases,10.1038/s41586-024-07571-1,Healthy - Small Intestine (first trimester),d661aeb3-5bf7-497d-832f-2399a1ef9b63.h5ad,29498
d68a8b48-abf0-4bd5-8834-155d34ec448a,0,0,,,blood;brain;intestine;kidney;liver;lung,Bronchopulmonary Dysplasia,,Bronchopulmonary dysplasia,d68a8b48-abf0-4bd5-8834-155d34ec448a.h5ad,271381
d6a5b240-cc8f-45c1-ad36-2fc291e15e8e,0,0,,,blood;brain;intestine;kidney;liver;lung,Human Brain Cell Atlas v1.0,10.1126/science.add7046,Dissection: Midbrain (M) - Pretectal region - PTR,d6a5b240-cc8f-45c1-ad36-2fc291e15e8e.h5ad,25875
d6dfdef1-406d-4efb-808c-3c5eddbfe0cb,7443,9,intestine,colon sessile serrated adenoma/polyp;normal;tubular adenoma,blood;brain;intestine;kidney;liver;lung,HTAN VUMC - Differential pre-malignant programs and microenvironment chart distinct paths to malignancy in human colorectal polyps,10.1016/j.cell.2021.11.031,Validation (Val) set of human colorectal tumor: Epithelial,d6dfdef1-406d-4efb-808c-3c5eddbfe0cb.h5ad,57723
d7476ae2-e320-4703-8304-da5c42627e71,0,0,,,blood;brain;intestine;kidney;liver;lung,HTAN/HTAPP Broad - Spatio-molecular dissection of the breast cancer metastatic microenvironment,10.1038/s41591-024-03215-z,HTAPP-330-SMP-1082 scRNA-seq,d7476ae2-e320-4703-8304-da5c42627e71.h5ad,565
d77ec7d6-ef2e-49d6-9e79-05b7f8881484,0,0,,,blood;brain;intestine;kidney;liver;lung,Tabula Sapiens,10.1126/science.abl4896,Tabula Sapiens - Prostate,d77ec7d6-ef2e-49d6-9e79-05b7f8881484.h5ad,21030
d7cff847-6403-44a6-ad8a-2f5a783639dd,0,0,,,blood;brain;intestine;kidney;liver;lung,Single-nucleus transcriptome analysis reveals cell-type-specific molecular signatures across reward circuitry in the human brain,10.1016/j.neuron.2021.09.001,NAC region,d7cff847-6403-44a6-ad8a-2f5a783639dd.h5ad,20571
d7d7e89c-c93a-422d-8958-9b4a90b69558,16901,15,blood,common variable immunodeficiency;normal,blood;brain;intestine;kidney;liver;lung,Single-cell Atlas of common variable immunodeficiency shows germinal center-associated epigenetic dysregulation in B-cell responses,10.1038/s41467-022-29450-x,Activated PBMCs - Twins scRNA-seq,d7d7e89c-c93a-422d-8958-9b4a90b69558.h5ad,16901
d7dcfd8f-2ee7-4385-b9ac-e074c23ed190,27197,24,kidney,normal,blood;brain;intestine;kidney;liver;lung,Spatiotemporal immune zonation of the human kidney,10.1126/science.aat5031,Fetal kidney dataset: full,d7dcfd8f-2ee7-4385-b9ac-e074c23ed190.h5ad,27197
d7f5d8d0-6150-48d7-b094-c34286ad11a1,1718915,61,brain,normal,blood;brain;intestine;kidney;liver;lung,An integrated transcriptomic cell atlas of human neural organoids,10.1038/s41586-024-08172-8,HNOCA Extended: The Human Neural Organoid Atlas,d7f5d8d0-6150-48d7-b094-c34286ad11a1.h5ad,1920454
d86edd6a-4b5d-437a-ad80-1fd976a5e23a,0,0,,,blood;brain;intestine;kidney;liver;lung,Automatic cell-type harmonization and integration across Human Cell Atlas datasets,10.1016/j.cell.2023.11.026,Blood,d86edd6a-4b5d-437a-ad80-1fd976a5e23a.h5ad,335916
